{
  "$schema": "./weekly-canvas-task.schema.json",
  "$comment": "HEXAI Weekly Canvas Task Workflow — W7-A 画布可演示交互闭环（拆分为 W7-A-01~04；旧 W7-A 单任务 run 停止推进）",

  "taskId": "W7-A",
  "taskTitle": "W7-A 画布可演示交互闭环",

  "reportRoot": "/Users/admin/project/ai/reviewDoc/W7",
  "codeRepo": "/Users/admin/project/ai/work/HEXAI",
  "reviewRoot": "/Users/admin/project/ai/reviewDoc",

  "stages": [
    {
      "id": "implementation-plan",
      "label": "实施方案",
      "requiredSkill": null,
      "ownerProfile": "claude-plan-minimax",
      "nextStage": "plan-review",
      "roundGroup": null
    },
    {
      "id": "plan-review",
      "label": "方案 Review",
      "requiredSkill": "hexai-plan-review",
      "ownerProfile": "claude-reviewer-deepseek",
      "nextStage": "plan-fix",
      "roundGroup": "plan"
    },
    {
      "id": "plan-fix",
      "label": "方案修订",
      "requiredSkill": "hexai-plan-fix",
      "ownerProfile": "claude-plan-minimax",
      "nextStage": "plan-fix-review",
      "roundGroup": "plan"
    },
    {
      "id": "plan-fix-review",
      "label": "方案修订 Review",
      "requiredSkill": "hexai-plan-review",
      "ownerProfile": "claude-reviewer-deepseek",
      "nextStage": "code-implementation",
      "roundGroup": "plan"
    },
    {
      "id": "code-implementation",
      "label": "代码实施",
      "requiredSkill": null,
      "ownerProfile": "claude-code-minimax",
      "nextStage": "code-review",
      "roundGroup": null
    },
    {
      "id": "code-review",
      "label": "Code Review",
      "requiredSkill": "hexai-code-review",
      "ownerProfile": "claude-reviewer-deepseek",
      "nextStage": "code-fix",
      "roundGroup": "code"
    },
    {
      "id": "code-fix",
      "label": "代码修复",
      "requiredSkill": "hexai-code-fix",
      "ownerProfile": "claude-code-minimax",
      "nextStage": "code-fix-review",
      "roundGroup": "code"
    },
    {
      "id": "code-fix-review",
      "label": "代码修复复审",
      "requiredSkill": "hexai-code-review",
      "ownerProfile": "claude-reviewer-deepseek",
      "nextStage": "delivery",
      "roundGroup": "code"
    },
    {
      "id": "delivery",
      "label": "交付物整理",
      "requiredSkill": "hexai-delivery",
      "ownerProfile": "claude-code-minimax",
      "nextStage": "done",
      "roundGroup": "delivery"
    },
    {
      "id": "done",
      "label": "完成",
      "requiredSkill": null,
      "ownerProfile": "codex-reviewlast",
      "nextStage": null,
      "roundGroup": null
    }
  ],

  "reviewStages": ["plan-review", "plan-fix-review", "code-review", "code-fix-review"],

  "fixStages": ["plan-fix", "code-fix"],

  "fixReviewStages": ["plan-fix-review", "code-fix-review"],

  "planStages": ["implementation-plan", "plan-fix"],

  "codeStages": ["code-implementation", "code-fix", "delivery"],

  "reviewLastStages": ["done"],

  "implementerStages": ["implementation-plan", "plan-fix", "code-implementation", "code-fix", "delivery"],

  "subtasks": [
    { "id": "W7-A-01", "title": "占位入口治理 + 交互 P0", "shortTitle": "占位入口治理与交互P0", "taskTheme": "W7-A画布可演示交互闭环" },
    { "id": "W7-A-02", "title": "F-05 右键菜单 MVP", "shortTitle": "F-05右键菜单MVP", "taskTheme": "W7-A画布可演示交互闭环" },
    { "id": "W7-A-03", "title": "Space QA 后移项确认", "shortTitle": "SpaceQA后移项确认", "taskTheme": "W7-A画布可演示交互闭环" },
    { "id": "W7-A-04", "title": "F-10 背景色最小闭环 / Mini Map 降级", "shortTitle": "F-10背景色闭环与MiniMap降级", "taskTheme": "W7-A画布可演示交互闭环" }
  ],

  "fileNaming": {
    "implementation-plan": {
      "pattern": "{reportDir}/{taskTheme}实施计划-{YYYYMMDD}.md"
    },
    "plan-review": {
      "pattern": "{reportDir}/{subtaskId}{shortTitle}计划Review意见-{YYYYMMDD}.md",
      "roundSuffix": "-{n}轮"
    },
    "plan-fix": {
      "pattern": "{reportDir}/{subtaskId}{shortTitle}计划FixReport-{YYYYMMDD}.md",
      "roundSuffix": "-{n}轮"
    },
    "plan-fix-review": {
      "pattern": "{reportDir}/{subtaskId}{shortTitle}计划FixReview意见-{YYYYMMDD}.md",
      "roundSuffix": "-{n}轮"
    },
    "code-implementation": {
      "pattern": "{reportDir}/{subtaskId}任务到代码映射-{YYYYMMDD}.md"
    },
    "code-review": {
      "pattern": "{reportDir}/{subtaskId}{shortTitle}CodeReview意见-{YYYYMMDD}.md",
      "roundSuffix": "-{n}轮"
    },
    "code-fix": {
      "pattern": "{reportDir}/{subtaskId}{shortTitle}CodeFix报告-{YYYYMMDD}.md",
      "roundSuffix": "-{n}轮"
    },
    "code-fix-review": {
      "pattern": "{reportDir}/{subtaskId}{shortTitle}CodeFix复审意见-{YYYYMMDD}.md",
      "roundSuffix": "-{n}轮"
    },
    "delivery": {
      "pattern": "{reportDir}/{subtaskId}交付物报告-{YYYYMMDD}.md"
    },
    "handoff": {
      "pattern": "{reportDir}/{subtaskId}-{stage}-handoff-{YYYYMMDD}.md"
    }
  },

  "requiredPlaybooks": {
    "plan-review": [
      "/Users/admin/project/ai/reviewDoc/ReviewPlaybooks/plan-review-playbook.md",
      "/Users/admin/project/ai/reviewDoc/ReviewPlaybooks/canvas-stage-review-playbook.md"
    ],
    "plan-fix-review": [
      "/Users/admin/project/ai/reviewDoc/ReviewPlaybooks/plan-review-playbook.md",
      "/Users/admin/project/ai/reviewDoc/ReviewPlaybooks/canvas-stage-review-playbook.md"
    ],
    "code-review": [
      "/Users/admin/project/ai/reviewDoc/ReviewPlaybooks/code-review-playbook.md",
      "/Users/admin/project/ai/reviewDoc/ReviewPlaybooks/canvas-stage-review-playbook.md"
    ],
    "code-fix-review": [
      "/Users/admin/project/ai/reviewDoc/ReviewPlaybooks/code-review-playbook.md",
      "/Users/admin/project/ai/reviewDoc/ReviewPlaybooks/canvas-stage-review-playbook.md"
    ]
  }
}
